docs/how_to/tutorials/tuning_logs/database_tuning_record.json
[0, [[[["GetBlock", [], ["matmul", "main"], ["b0"]], ["GetBlock", [], ["T_add", "main"], ["b1"]], ["GetBlock", [], ["root", "main"], ["b2"]], ["Annotate", ["b0", "\"SSSRRSRS\""], ["meta_schedule.tiling_structure"], []], ["GetLoops", ["b0"], [], ["l3", "l4", "l5"]], ["SamplePerfectTile", ["l3"], [5, 64], ["v6", "v7", "v8", "v9", "v10"]], ["Split", ["l3", "v6", "v7", "v8", "v9", "v10"], [1, 0], ["l11", "l12", "l13", "l14", "l15"]], ["SamplePerfectTile", ["l4"], [5, 64], ["v16", "v17", "v18", "v19", "v20"]], ["Split", ["l4", "v16", "v17", "v18", "v19", "v20"], [1, 0], ["l21", "l22", "l23", "l24", "l25"]], ["SamplePerfectTile", ["l5"], [3, 64], ["v26", "v27", "v28"]], ["Split", ["l5", "v26", "v27", "v28"], [1, 0], ["l29", "l30", "l31"]], ["Reorder", ["l11", "l21", "l12", "l22", "l13", "l23", "l29", "l30", "l14", "l24", "l31", "l15", "l25"], [], []], ["Fuse", ["l11", "l21"], [1], ["l32"]], ["Bind", ["l32"], ["blockIdx.x"], []], ["Fuse", ["l12", "l22"], [1], ["l33"]], ["Bind", ["l33"], ["vthread.x"], []], ["Fuse", ["l13", "l23"], [1], ["l34"]], ["Bind", ["l34"], ["threadIdx.x"], []], ["Annotate", ["b0", 32], ["meta_schedule.thread_extent_low_inclusive"], []], ["Annotate", ["b0", 1024], ["meta_schedule.thread_extent_high_inclusive"], []], ["CacheWrite", ["b0", []], [0, "local"], ["b35"]], ["ReverseComputeAt", ["b35", "l34"], [1, -1], []], ["CacheRead", ["b0", ["b0"]], [0, "shared"], ["b36"]], ["ComputeAt", ["b36", "l29"], [1, -1], []], ["GetLoops", ["b36"], [], ["l37", "l38", "l39", "l40", "l41", "l42"]], ["Fuse", ["l41", "l42"], [1], ["l43"]], ["SampleCategorical", [], [[1, 2, 3, 4], [0.25, 0.25, 0.25, 0.25]], ["v44"]], ["Annotate", ["b36", "v44"], ["meta_schedule.cooperative_fetch"], []], ["CacheRead", ["b0", ["b0"]], [1, "shared"], ["b45"]], ["ComputeAt", ["b45", "l29"], [1, -1], []], ["GetLoops", ["b45"], [], ["l46", "l47", "l48", "l49", "l50", "l51"]], ["Fuse", ["l50", "l51"], [1], ["l52"]], ["SampleCategorical", [], [[1, 2, 3, 4], [0.25, 0.25, 0.25, 0.25]], ["v53"]], ["Annotate", ["b45", "v53"], ["meta_schedule.cooperative_fetch"], []], ["ReverseComputeInline", ["b1"], [], []], ["SampleCategorical", [], [[0, 16, 64, 512, 1024], [0.2, 0.2, 0.2, 0.2, 0.2]], ["v54"]], ["Annotate", ["b2", "v54"], ["meta_schedule.unroll_explicit"], []], ["EnterPostproc", [], [], []], ["Unannotate", ["b36"], ["meta_schedule.cooperative_fetch"], []], ["GetLoops", ["b36"], [], ["l55", "l56", "l57", "l58", "l59"]], ["Split", ["l59", "None", 40], [1, 0], ["l60", "l61"]], ["Bind", ["l61"], ["threadIdx.x"], []], ["Unannotate", ["b45"], ["meta_schedule.cooperative_fetch"], []], ["GetLoops", ["b45"], [], ["l62", "l63", "l64", "l65", "l66"]], ["Split", ["l66", "None", 40, 4], [1, 0], ["l67", "l68", "l69"]], ["Vectorize", ["l69"], [], []], ["Bind", ["l68"], ["threadIdx.x"], []], ["GetBlock", [], ["root", "main"], ["b70"]], ["Unannotate", ["b70"], ["meta_schedule.unroll_explicit"], []], ["GetChildBlocks", ["b70"], [], ["b71", "b72", "b73", "b74"]], ["GetLoops", ["b71"], [], ["l75", "l76", "l77", "l78", "l79", "l80"]], ["GetLoops", ["b72"], [], ["l81", "l82", "l83", "l84", "l85", "l86", "l87"]], ["GetLoops", ["b73"], [], ["l88", "l89", "l90", "l91", "l92", "l93", "l94", "l95", "l96", "l97"]], ["Annotate", ["l88", 16], ["pragma_auto_unroll_max_step"], []], ["Annotate", ["l88", 1], ["pragma_unroll_explicit"], []], ["GetLoops", ["b74"], [], ["l98", "l99", "l100", "l101", "l102"]], ["GetBlock", [], ["matmul", "main"], ["b103"]], ["GetLoops", ["b103"], [], ["l104", "l105", "l106", "l107", "l108", "l109", "l110", "l111", "l112", "l113"]], ["DecomposeReduction", ["b103", "l107"], [], ["b114"]]], [[5, [1, 1, 1, 1, 1]], [7, [25, 1, 40, 1, 1]], [9, [4, 8, 16]], [26, 0], [32, 3], [35, 1]]], [5.5226040271265905e-06], {"arch": "sm_86", "keys": ["cuda", "gpu"], "kind": "cuda", "max_num_threads": 1024, "max_shared_memory_per_block": 49152, "max_threads_per_block": 1024, "registers_per_block": 65536, "tag": "", "thread_warp_size": 32}, [["TENSOR", "float32", [1, 512]], ["TENSOR", "float32", [512, 1000]], ["TENSOR", "float32", [1000]], ["TENSOR", "float32", [1, 1000]]]]]
[1, [[[["GetBlock", [], ["T_transpose", "main"], ["b0"]], ["GetLoops", ["b0"], [], ["l1", "l2"]], ["Fuse", ["l1", "l2"], [1], ["l3"]], ["Split", ["l3", "None", 256, 1024], [1, 0], ["l4", "l5", "l6"]], ["Reorder", ["l5", "l6", "l4"], [], []], ["Bind", ["l5"], ["blockIdx.x"], []], ["Bind", ["l6"], ["threadIdx.x"], []], ["EnterPostproc", [], [], []]], []], [1.1075577156743621e-05], {"arch": "sm_86", "keys": ["cuda", "gpu"], "kind": "cuda", "max_num_threads": 1024, "max_shared_memory_per_block": 49152, "max_threads_per_block": 1024, "registers_per_block": 65536, "tag": "", "thread_warp_size": 32}, [["TENSOR", "float32", [1000, 512]], ["TENSOR", "float32", [512, 1000]]]]]
[2, [[[["GetBlock", [], ["T_reshape", "main"], ["b0"]], ["GetLoops", ["b0"], [], ["l1", "l2"]], ["Fuse", ["l1", "l2"], [1], ["l3"]], ["SampleCategorical", [], [[32, 64, 128, 256, 512], [0.2, 0.2, 0.2, 0.2, 0.2]], ["v4"]], ["Split", ["l3", "None", "v4"], [1, 0], ["l5", "l6"]], ["Bind", ["l5"], ["blockIdx.x"], []], ["Bind", ["l6"], ["threadIdx.x"], []], ["EnterPostproc", [], [], []]], [[3, 2]]], [1.9609987431196635e-06], {"arch": "sm_86", "keys": ["cuda", "gpu"], "kind": "cuda", "max_num_threads": 1024, "max_shared_memory_per_block": 49152, "max_threads_per_block": 1024, "registers_per_block": 65536, "tag": "", "thread_warp_size": 32}, [["TENSOR", "float32", [1, 512, 1, 1]], ["TENSOR", "float32", [1, 512]]]]]
[3, [[[["GetBlock", [], ["adaptive_pool_sum", "main"], ["b0"]], ["GetBlock", [], ["adaptive_pool_avg", "main"], ["b1"]], ["GetBlock", [], ["root", "main"], ["b2"]], ["Unannotate", ["b1"], ["schedule_rule"], []], ["GetConsumers", ["b0"], [], ["b3"]], ["GetLoops", ["b3"], [], ["l4", "l5", "l6", "l7"]], ["SampleCategorical", [], [[4, 8, 16, 32, 64, 128, 256, 512], [0.125, 0.125, 0.125, 0.125, 0.125, 0.125, 0.125, 0.125]], ["v8"]], ["Split", ["l7", "None", "v8"], [1, 0], ["l9", "l10"]], ["Bind", ["l10"], ["threadIdx.x"], []], ["ComputeAt", ["b0", "l9"], [1, -1], []], ["SetScope", ["b0"], [0, "shared"], []], ["GetLoops", ["b0"], [], ["l11", "l12", "l13", "l14", "l15", "l16", "l17", "l18", "l19", "l20"]], ["Fuse", ["l19", "l20"], [1], ["l21"]], ["Split", ["l21", "None", "v8"], [1, 0], ["l22", "l23"]], ["Bind", ["l23"], ["threadIdx.x"], []], ["SampleCategorical", [], [[0, 16, 64, 512, 1024], [0.2, 0.2, 0.2, 0.2, 0.2]], ["v24"]], ["Annotate", ["b2", "v24"], ["meta_schedule.unroll_explicit"], []], ["GetLoops", ["b1"], [], ["l25", "l26", "l27", "l28", "l29"]], ["Fuse", ["l25", "l26", "l27", "l28"], [1], ["l30"]], ["Bind", ["l30"], ["blockIdx.x"], []], ["EnterPostproc", [], [], []], ["GetBlock", [], ["root", "main"], ["b31"]], ["Unannotate", ["b31"], ["meta_schedule.unroll_explicit"], []], ["GetChildBlocks", ["b31"], [], ["b32", "b33"]], ["GetLoops", ["b32"], [], ["l34", "l35", "l36", "l37", "l38", "l39", "l40"]], ["Annotate", ["l34", 16], ["pragma_auto_unroll_max_step"], []], ["Annotate", ["l34", 1], ["pragma_unroll_explicit"], []], ["GetLoops", ["b33"], [], ["l41", "l42"]]], [[6, 2], [15, 1]]], [2.056084508425311e-06], {"arch": "sm_86", "keys": ["cuda", "gpu"], "kind": "cuda", "max_num_threads": 1024, "max_shared_memory_per_block": 49152, "max_threads_per_block": 1024, "registers_per_block": 65536, "tag": "", "thread_warp_size": 32}, [["TENSOR", "float32", [1, 512, 7, 7]], ["TENSOR", "float32", [1, 512, 1, 1]]]]]
[4, [[[["GetBlock", [], ["pad_temp", "main"], ["b0"]], ["GetBlock", [], ["conv2d_nchw", "main"], ["b1"]], ["GetBlock", [], ["T_subtract", "main"], ["b2"]], ["GetBlock", [], ["T_divide", "main"], ["b3"]], ["GetBlock", [], ["expand_dims", "main"], ["b4"]], ["GetBlock", [], ["T_multiply", "main"], ["b5"]], ["GetBlock", [], ["expand_dims_1", "main"], ["b6"]], ["GetBlock", [], ["T_add", "main"], ["b7"]], ["GetBlock", [], ["compute", "main"], ["b8"]], ["GetBlock", [], ["root", "main"], ["b9"]], ["Annotate", ["b1", "\"SSSRRSRS\""], ["meta_schedule.tiling_structure"], []], ["GetLoops", ["b1"], [], ["l10", "l11", "l12", "l13", "l14", "l15", "l16"]], ["SamplePerfectTile", ["l10"], [5, 64], ["v17", "v18", "v19", "v20", "v21"]], ["Split", ["l10", "v17", "v18", "v19", "v20", "v21"], [1, 0], ["l22", "l23", "l24", "l25", "l26"]], ["SamplePerfectTile", ["l11"], [5, 64], ["v27", "v28", "v29", "v30", "v31"]], ["Split", ["l11", "v27", "v28", "v29", "v30", "v31"], [1, 0], ["l32", "l33", "l34", "l35", "l36"]], ["SamplePerfectTile", ["l12"], [5, 64], ["v37", "v38", "v39", "v40", "v41"]], ["Split", ["l12", "v37", "v38", "v39", "v40", "v41"], [1, 0], ["l42", "l43", "l44", "l45", "l46"]], ["SamplePerfectTile", ["l13"], [5, 64], ["v47", "v48", "v49", "v50", "v51"]], ["Split", ["l13", "v47", "v48", "v49", "v50", "v51"], [1, 0], ["l52", "l53", "l54", "l55", "l56"]], ["SamplePerfectTile", ["l14"], [3, 64], ["v57", "v58", "v59"]], ["Split", ["l14", "v57", "v58", "v59"], [1, 0], ["l60", "l61", "l62"]], ["SamplePerfectTile", ["l15"], [3, 64], ["v63", "v64", "v65"]], ["Split", ["l15", "v63", "v64", "v65"], [1, 0], ["l66", "l67", "l68"]], ["SamplePerfectTile", ["l16"], [3, 64], ["v69", "v70", "v71"]], ["Split", ["l16", "v69", "v70", "v71"], [1, 0], ["l72", "l73", "l74"]], ["Reorder", ["l22", "l32", "l42", "l52", "l23", "l33", "l43", "l53", "l24", "l34", "l44", "l54", "l60", "l66", "l72", "l61", "l67", "l73", "l25", "l35", "l45", "l55", "l62", "l68", "l74", "l26", "l36", "l46", "l56"], [], []], ["Fuse", ["l22", "l32", "l42", "l52"], [1], ["l75"]], ["Bind", ["l75"], ["blockIdx.x"], []], ["Fuse", ["l23", "l33", "l43", "l53"], [1], ["l76"]], ["Bind", ["l76"], ["vthread.x"], []], ["Fuse", ["l24", "l34", "l44", "l54"], [1], ["l77"]], ["Bind", ["l77"], ["threadIdx.x"], []], ["Annotate", ["b1", 32], ["meta_schedule.thread_extent_low_inclusive"], []], ["Annotate", ["b1", 1024], ["meta_schedule.thread_extent_high_inclusive"], []], ["CacheWrite", ["b1", []], [0, "local"], ["b78"]], ["ReverseComputeAt", ["b78", "l77"], [1, -1], []], ["CacheRead", ["b1", ["b1"]], [0, "shared"], ["b79"]], ["ComputeAt", ["b79", "l72"], [1, -1], []], ["GetLoops", ["b79"], [], ["l80", "l81", "l82", "l83", "l84", "l85", "l86", "l87", "l88", "l89"]], ["Fuse", ["l86", "l87", "l88", "l89"], [1], ["l90"]], ["SampleCategorical", [], [[1, 2, 3, 4], [0.25, 0.25, 0.25, 0.25]], ["v91"]], ["Annotate", ["b79", "v91"], ["meta_schedule.cooperative_fetch"], []], ["CacheRead", ["b1", ["b1"]], [1, "shared"], ["b92"]], ["ComputeAt", ["b92", "l72"], [1, -1], []], ["GetLoops", ["b92"], [], ["l93", "l94", "l95", "l96", "l97", "l98", "l99", "l100", "l101", "l102"]], ["Fuse", ["l99", "l100", "l101", "l102"], [1], ["l103"]], ["SampleCategorical", [], [[1, 2, 3, 4], [0.25, 0.25, 0.25, 0.25]], ["v104"]], ["Annotate", ["b92", "v104"], ["meta_schedule.cooperative_fetch"], []], ["ReverseComputeInline", ["b8"], [], []], ["ComputeInline", ["b6"], [], []], ["ComputeInline", ["b5"], [], []], ["ComputeInline", ["b4"], [], []], ["ComputeInline", ["b3"], [], []], ["ComputeInline", ["b2"], [], []], ["ComputeInline", ["b0"], [], []], ["SampleCategorical", [], [[0, 16, 64, 512, 1024], [0.2, 0.2, 0.2, 0.2, 0.2]], ["v105"]], ["Annotate", ["b9", "v105"], ["meta_schedule.unroll_explicit"], []], ["GetLoops", ["b7"], [], ["l106", "l107", "l108", "l109"]], ["Fuse", ["l106", "l107", "l108", "l109"], [1], ["l110"]], ["SampleCategorical", [], [[32, 64, 128, 256, 512, 1024], [0.16666666666666666, 0.16666666666666666, 0.16666666666666666, 0.16666666666666666, 0.16666666666666666, 0.16666666666666666]], ["v111"]], ["Split", ["l110", "None", "v111"], [1, 0], ["l112", "l113"]], ["Bind", ["l112"], ["blockIdx.x"], []], ["Bind", ["l113"], ["threadIdx.x"], []], ["EnterPostproc", [], [], []], ["Unannotate", ["b79"], ["meta_schedule.cooperative_fetch"], []], ["GetLoops", ["b79"], [], ["l114", "l115", "l116", "l117", "l118", "l119", "l120"]], ["Split", ["l120", "None", 56], [1, 0], ["l121", "l122"]], ["Bind", ["l122"], ["threadIdx.x"], []], ["Unannotate", ["b92"], ["meta_schedule.cooperative_fetch"], []], ["GetLoops", ["b92"], [], ["l123", "l124", "l125", "l126", "l127", "l128", "l129"]], ["Split", ["l129", "None", 56, 3], [1, 0], ["l130", "l131", "l132"]], ["Vectorize", ["l132"], [], []], ["Bind", ["l131"], ["threadIdx.x"], []], ["GetBlock", [], ["root", "main"], ["b133"]], ["Unannotate", ["b133"], ["meta_schedule.unroll_explicit"], []], ["GetChildBlocks", ["b133"], [], ["b134", "b135", "b136", "b137", "b138"]], ["GetLoops", ["b134"], [], ["l139", "l140", "l141", "l142", "l143", "l144", "l145", "l146"]], ["GetLoops", ["b135"], [], ["l147", "l148", "l149", "l150", "l151", "l152", "l153", "l154", "l155"]], ["GetLoops", ["b136"], [], ["l156", "l157", "l158", "l159", "l160", "l161", "l162", "l163", "l164", "l165", "l166", "l167", "l168", "l169", "l170", "l171", "l172", "l173", "l174", "l175"]], ["Annotate", ["l156", 1024], ["pragma_auto_unroll_max_step"], []], ["Annotate", ["l156", 1], ["pragma_unroll_explicit"], []], ["GetLoops", ["b137"], [], ["l176", "l177", "l178", "l179", "l180", "l181", "l182"]], ["GetLoops", ["b138"], [], ["l183", "l184"]], ["GetBlock", [], ["conv2d_nchw", "main"], ["b185"]], ["GetLoops", ["b185"], [], ["l186", "l187", "l188", "l189", "l190", "l191", "l192", "l193", "l194", "l195", "l196", "l197", "l198", "l199", "l200", "l201", "l202", "l203", "l204", "l205"]], ["DecomposeReduction", ["b185", "l189"], [], ["b206"]]], [[12, [1, 1, 1, 1, 1]], [14, [64, 1, 8, 1, 1]], [16, [1, 1, 7, 1, 1]], [18, [1, 1, 1, 7, 1]], [20, [32, 8, 2]], [22, [1, 3, 1]], [24, [1, 3, 1]], [41, 0], [47, 2], [56, 4], [60, 2]]], [6.611344527986633e-05], {"arch": "sm_86", "keys": ["cuda", "gpu"], "kind": "cuda", "max_num_threads": 1024, "max_shared_memory_per_block": 49152, "max_threads_per_block": 1024, "registers_per_block": 65536, "tag": "", "thread_warp_size": 32}, [["TENSOR", "float32", [1, 512, 7, 7]], ["TENSOR", "float32", [512, 512, 3, 3]], ["TENSOR", "float32", [1, 512, 1, 1]], ["TENSOR", "float32", [1, 512, 1, 1]], ["TENSOR", "float32", [512]], ["TENSOR", "float32", [512]], ["TENSOR", "float32", [1, 512, 7, 7]]]]]
[5, [[[["GetBlock", [], ["pad_temp", "main"], ["b0"]], ["GetBlock", [], ["conv2d_nchw", "main"], ["b1"]], ["GetBlock", [], ["T_subtract", "main"], ["b2"]], ["GetBlock", [], ["T_divide", "main"], ["b3"]], ["GetBlock", [], ["expand_dims", "main"], ["b4"]], ["GetBlock", [], ["T_multiply", "main"], ["b5"]], ["GetBlock", [], ["expand_dims_1", "main"], ["b6"]], ["GetBlock", [], ["T_add", "main"], ["b7"]], ["GetBlock", [], ["compute", "main"], ["b8"]], ["GetBlock", [], ["root", "main"], ["b9"]], ["Annotate", ["b1", "\"SSSRRSRS\""], ["meta_schedule.tiling_structure"], []], ["GetLoops", ["b1"], [], ["l10", "l11", "l12", "l13", "l14", "l15", "l16"]], ["SamplePerfectTile", ["l10"], [5, 64], ["v17", "v18", "v19", "v20", "v21"]], ["Split", ["l10", "v17", "v18", "v19", "v20", "v21"], [1, 0], ["l22", "l23", "l24", "l25", "l26"]], ["SamplePerfectTile", ["l11"], [5, 64], ["v27", "v28", "v29", "v30", "v31"]], ["Split", ["l11", "v27", "v28", "v29", "v30", "v31"], [1, 0], ["l32", "l33", "l34", "l35", "l36"]], ["SamplePerfectTile", ["l12"], [5, 64], ["v37", "v38", "v39", "v40", "v41"]], ["Split", ["l12", "v37", "v38", "v39", "v40", "v41"], [1, 0], ["l42", "l43", "l44", "l45", "l46"]], ["SamplePerfectTile", ["l13"], [5, 64], ["v47", "v48", "v49", "v50", "v51"]], ["Split", ["l13", "v47", "v48", "v49", "v50", "v51"], [1, 0], ["l52", "l53", "l54", "l55", "l56"]], ["SamplePerfectTile", ["l14"], [3, 64], ["v57", "v58", "v59"]], ["Split", ["l14", "v57", "v58", "v59"], [1, 0], ["l60", "l61", "l62"]], ["SamplePerfectTile", ["l15"], [3, 64], ["v63", "v64", "v65"]], ["Split", ["l15", "v63", "v64", "v65"], [1, 0], ["l66", "l67", "l68"]], ["SamplePerfectTile", ["l16"], [3, 64], ["v69", "v70", "v71"]], ["Split", ["l16", "v69", "v70", "v71"], [1, 0], ["l72", "l73", "l74"]], ["Reorder", ["l22", "l32", "l42", "l52", "l23", "l33", "l43", "l53", "l24", "l34", "l44", "l54", "l60", "l66", "l72", "l61", "l67", "l73", "l25", "l35", "l45", "l55", "l62", "l68", "l74", "l26", "l36", "l46", "l56"], [], []], ["Fuse", ["l22", "l32", "l42", "l52"], [1], ["l75"]], ["Bind", ["l75"], ["blockIdx.x"], []], ["Fuse", ["l23", "l33", "l43", "l53"], [1], ["l76"]], ["Bind", ["l76"], ["vthread.x"], []], ["Fuse", ["l24", "l34", "l44", "l54"], [1], ["l77"]], ["Bind", ["l77"], ["threadIdx.x"], []], ["Annotate", ["b1", 32], ["meta_schedule.thread_extent_low_inclusive"], []], ["Annotate", ["b1", 1024], ["meta_schedule.thread_extent_high_inclusive"], []], ["CacheWrite", ["b1", []], [0, "local"], ["b78"]], ["ReverseComputeAt", ["b78", "l77"], [1, -1], []], ["CacheRead", ["b1", ["b1"]], [0, "shared"], ["b79"]], ["ComputeAt", ["b79", "l72"], [1, -1], []], ["GetLoops", ["b79"], [], ["l80", "l81", "l82", "l83", "l84", "l85", "l86", "l87", "l88", "l89"]], ["Fuse", ["l86", "l87", "l88", "l89"], [1], ["l90"]], ["SampleCategorical", [], [[1, 2, 3, 4], [0.25, 0.25, 0.25, 0.25]], ["v91"]], ["Annotate", ["b79", "v91"], ["meta_schedule.cooperative_fetch"], []], ["CacheRead", ["b1", ["b1"]], [1, "shared"], ["b92"]], ["ComputeAt", ["b92", "l72"], [1, -1], []], ["GetLoops", ["b92"], [], ["l93", "l94", "l95", "l96", "l97", "l98", "l99", "l100", "l101", "l102"]], ["Fuse", ["l99", "l100", "l101", "l102"], [1], ["l103"]], ["SampleCategorical", [], [[1, 2, 3, 4], [0.25, 0.25, 0.25, 0.25]], ["v104"]], ["Annotate", ["b92", "v104"], ["meta_schedule.cooperative_fetch"], []], ["ReverseComputeInline", ["b8"], [], []], ["ComputeInline", ["b6"], [], []], ["ComputeInline", ["b5"], [], []], ["ComputeInline", ["b4"], [], []], ["ComputeInline", ["b3"], [], []], ["ComputeInline", ["b2"], [], []], ["ComputeInline", ["b0"], [], []], ["SampleCategorical", [], [[0, 16, 64, 512, 1024], [0.2, 0.2, 0.2, 0.2, 0.2]], ["v105"]], ["Annotate", ["b9", "v105"], ["meta_schedule.unroll_explicit"], []], ["GetLoops", ["b7"], [], ["l106", "l107", "l108", "l109"]], ["Fuse", ["l106", "l107", "l108", "l109"], [1], ["l110"]], ["Split", ["l110", "None", 256, 1024], [1, 0], ["l111", "l112", "l113"]], ["Reorder", ["l112", "l113", "l111"], [], []], ["Bind", ["l112"], ["blockIdx.x"], []], ["Bind", ["l113"], ["threadIdx.x"], []], ["EnterPostproc", [], [], []], ["Unannotate", ["b79"], ["meta_schedule.cooperative_fetch"], []], ["GetLoops", ["b79"], [], ["l114", "l115", "l116", "l117", "l118", "l119", "l120"]], ["Split", ["l120", "None", 128, 3], [1, 0], ["l121", "l122", "l123"]], ["Vectorize", ["l123"], [], []], ["Bind", ["l122"], ["threadIdx.x"], []], ["Unannotate", ["b92"], ["meta_schedule.cooperative_fetch"], []], ["GetLoops", ["b92"], [], ["l124", "l125", "l126", "l127", "l128", "l129", "l130"]], ["Split", ["l130", "None", 128], [1, 0], ["l131", "l132"]], ["Bind", ["l132"], ["threadIdx.x"], []], ["GetBlock", [], ["root", "main"], ["b133"]], ["Unannotate", ["b133"], ["meta_schedule.unroll_explicit"], []], ["GetChildBlocks", ["b133"], [], ["b134", "b135", "b136", "b137", "b138"]], ["GetLoops", ["b134"], [], ["l139", "l140", "l141", "l142", "l143", "l144", "l145", "l146", "l147"]], ["GetLoops", ["b135"], [], ["l148", "l149", "l150", "l151", "l152", "l153", "l154", "l155"]], ["GetLoops", ["b136"], [], ["l156", "l157", "l158", "l159", "l160", "l161", "l162", "l163", "l164", "l165", "l166", "l167", "l168", "l169", "l170", "l171", "l172", "l173", "l174", "l175"]], ["Annotate", ["l156", 1024], ["pragma_auto_unroll_max_step"], []], ["Annotate", ["l156", 1], ["pragma_unroll_explicit"], []], ["GetLoops", ["b137"], [], ["l176", "l177", "l178", "l179", "l180", "l181", "l182"]], ["GetLoops", ["b138"], [], ["l183", "l184", "l185"]], ["GetBlock", [], ["conv2d_nchw", "main"], ["b186"]], ["GetLoops", ["b186"], [], ["l187", "l188", "l189", "l190", "l191", "l192", "l193", "l194", "l195", "l196", "l197", "l198", "l199", "l200", "l201", "l202", "l203", "l204", "l205", "l206"]], ["DecomposeReduction", ["b186", "l190"], [], ["b207"]]], [[12, [1, 1, 1, 1, 1]], [14, [1, 4, 4, 4, 1]], [16, [14, 1, 8, 1, 1]], [18, [14, 1, 4, 2, 1]], [20, [1, 3, 1]], [22, [7, 1, 1]], [24, [1, 1, 7]], [41, 2], [47, 0], [56, 4]]], [3.68583596511361e-05], {"arch": "sm_86", "keys": ["cuda", "gpu"], "kind": "cuda", "max_num_threads": 1024, "max_shared_memory_per_block": 49152, "max_threads_per_block": 1024, "registers_per_block": 65536, "tag": "", "thread_warp_size": 32}, [["TENSOR", "float32", [1, 3, 224, 224]], ["TENSOR", "float32", [64, 3, 7, 7]], ["TENSOR", "float32", [1, 64, 1, 1]], ["TENSOR", "float32", [1, 64, 1, 1]], ["TENSOR", "float32", [64]], ["TENSOR", "float32", [64]], ["TENSOR", "float32", [1, 64, 112, 112]]]]]
[6, [[[["GetBlock", [], ["pad_temp", "main"], ["b0"]], ["GetBlock", [], ["conv2d_nchw", "main"], ["b1"]], ["GetBlock", [], ["T_subtract", "main"], ["b2"]], ["GetBlock", [], ["T_divide", "main"], ["b3"]], ["GetBlock", [], ["expand_dims", "main"], ["b4"]], ["GetBlock", [], ["T_multiply", "main"], ["b5"]], ["GetBlock", [], ["expand_dims_1", "main"], ["b6"]], ["GetBlock", [], ["T_add", "main"], ["b7"]], ["GetBlock", [], ["compute", "main"], ["b8"]], ["GetBlock", [], ["root", "main"], ["b9"]], ["Annotate", ["b1", "\"SSSRRSRS\""], ["meta_schedule.tiling_structure"], []], ["GetLoops", ["b1"], [], ["l10", "l11", "l12", "l13", "l14", "l15", "l16"]], ["SamplePerfectTile", ["l10"], [5, 64], ["v17", "v18", "v19", "v20", "v21"]], ["Split", ["l10", "v17", "v18", "v19", "v20", "v21"], [1, 0], ["l22", "l23", "l24", "l25", "l26"]], ["SamplePerfectTile", ["l11"], [5, 64], ["v27", "v28", "v29", "v30", "v31"]], ["Split", ["l11", "v27", "v28", "v29", "v30", "v31"], [1, 0], ["l32", "l33", "l34", "l35", "l36"]], ["SamplePerfectTile", ["l12"], [5, 64], ["v37", "v38", "v39", "v40", "v41"]], ["Split", ["l12", "v37", "v38", "v39", "v40", "v41"], [1, 0], ["l42", "l43", "l44", "l45", "l46"]], ["SamplePerfectTile", ["l13"], [5, 64], ["v47", "v48", "v49", "v50", "v51"]], ["Split", ["l13", "v47", "v48", "v49", "v50", "v51"], [1, 0], ["l52", "l53", "l54", "l55", "l56"]], ["SamplePerfectTile", ["l14"], [3, 64], ["v57", "v58", "v59"]], ["Split", ["l14", "v57", "v58", "v59"], [1, 0], ["l60", "l61", "l62"]], ["SamplePerfectTile", ["l15"], [3, 64], ["v63", "v64", "v65"]], ["Split", ["l15", "v63", "v64", "v65"], [1, 0], ["l66", "l67", "l68"]], ["SamplePerfectTile", ["l16"], [3, 64], ["v69", "v70", "v71"]], ["Split", ["l16", "v69", "v70", "v71"], [1, 0], ["l72", "l73", "l74"]], ["Reorder", ["l22", "l32", "l42", "l52", "l23", "l33", "l43", "l53", "l24", "l34", "l44", "l54", "l60", "l66", "l72", "l61", "l67", "l73", "l25", "l35", "l45", "l55", "l62", "l68", "l74", "l26", "l36", "l46", "l56"], [], []], ["Fuse", ["l22", "l32", "l42", "l52"], [1], ["l75"]], ["Bind", ["l75"], ["blockIdx.x"], []], ["Fuse", ["l23", "l33", "l43", "l53"], [1], ["l76"]], ["Bind", ["l76"], ["vthread.x"], []], ["Fuse", ["l24", "l34", "l44", "l54"], [1], ["l77"]], ["Bind", ["l77"], ["threadIdx.x"], []], ["Annotate", ["b1", 32], ["meta_schedule.thread_extent_low_inclusive"], []], ["Annotate", ["b1", 1024], ["meta_schedule.thread_extent_high_inclusive"], []], ["CacheWrite", ["b1", []], [0, "local"], ["b78"]], ["ReverseComputeAt", ["b78", "l77"], [1, -1], []], ["CacheRead", ["b1", ["b1"]], [0, "shared"], ["b79"]], ["ComputeAt", ["b79", "l72"], [1, -1], []], ["GetLoops", ["b79"], [], ["l80", "l81", "l82", "l83", "l84", "l85", "l86", "l87", "l88", "l89"]], ["Fuse", ["l86", "l87", "l88", "l89"], [1], ["l90"]], ["SampleCategorical", [], [[1, 2, 3, 4], [0.25, 0.25, 0.25, 0.25]], ["v91"]], ["Annotate", ["b79", "v91"], ["meta_schedule.cooperative_fetch"], []], ["CacheRead", ["b1", ["b1"]], [1, "shared"], ["b92"]], ["ComputeAt", ["b92", "l72"], [1, -1], []], ["GetLoops", ["b92"], [], ["l93", "l94", "l95", "l96", "l97", "l98", "l99", "l100", "l101", "l102"]], ["Fuse", ["l99", "l100", "l101", "l102"], [1], ["l103"]], ["SampleCategorical", [], [[1, 2, 3, 4], [0.25, 0.25, 0.25, 0.25]], ["v104"]], ["Annotate", ["b92", "v104"], ["meta_schedule.cooperative_fetch"], []], ["ReverseComputeInline", ["b8"], [], []], ["ComputeInline", ["b6"], [], []], ["ComputeInline", ["b5"], [], []], ["ComputeInline", ["b4"], [], []], ["ComputeInline", ["b3"], [], []], ["ComputeInline", ["b2"], [], []], ["ComputeInline", ["b0"], [], []], ["SampleCategorical", [], [[0, 16, 64, 512, 1024], [0.2, 0.2, 0.2, 0.2, 0.2]], ["v105"]], ["Annotate", ["b9", "v105"], ["meta_schedule.unroll_explicit"], []], ["GetLoops", ["b7"], [], ["l106", "l107", "l108", "l109"]], ["Fuse", ["l106", "l107", "l108", "l109"], [1], ["l110"]], ["SampleCategorical", [], [[32, 64, 128, 256, 512, 1024], [0.16666666666666666, 0.16666666666666666, 0.16666666666666666, 0.16666666666666666, 0.16666666666666666, 0.16666666666666666]], ["v111"]], ["Split", ["l110", "None", "v111"], [1, 0], ["l112", "l113"]], ["Bind", ["l112"], ["blockIdx.x"], []], ["Bind", ["l113"], ["threadIdx.x"], []], ["EnterPostproc", [], [], []], ["Unannotate", ["b79"], ["meta_schedule.cooperative_fetch"], []], ["GetLoops", ["b79"], [], ["l114", "l115", "l116", "l117", "l118", "l119", "l120"]], ["Split", ["l120", "None", 98, 4], [1, 0], ["l121", "l122", "l123"]], ["Vectorize", ["l123"], [], []], ["Bind", ["l122"], ["threadIdx.x"], []], ["Unannotate", ["b92"], ["meta_schedule.cooperative_fetch"], []], ["GetLoops", ["b92"], [], ["l124", "l125", "l126", "l127", "l128", "l129", "l130"]], ["Split", ["l130", "None", 98, 4], [1, 0], ["l131", "l132", "l133"]], ["Vectorize", ["l133"], [], []], ["Bind", ["l132"], ["threadIdx.x"], []], ["GetBlock", [], ["root", "main"], ["b134"]], ["Unannotate", ["b134"], ["meta_schedule.unroll_explicit"], []], ["GetChildBlocks", ["b134"], [], ["b135", "b136", "b137", "b138", "b139"]], ["GetLoops", ["b135"], [], ["l140", "l141", "l142", "l143", "l144", "l145", "l146", "l147", "l148"]], ["GetLoops", ["b136"], [], ["l149", "l150", "l151", "l152", "l153", "l154", "l155", "l156", "l157"]], ["GetLoops", ["b137"], [], ["l158", "l159", "l160", "l161", "l162", "l163", "l164", "l165", "l166", "l167", "l168", "l169", "l170", "l171", "l172", "l173", "l174", "l175", "l176", "l177"]], ["Annotate", ["l158", 1024], ["pragma_auto_unroll_max_step"], []], ["Annotate", ["l158", 1], ["pragma_unroll_explicit"], []], ["GetLoops", ["b138"], [], ["l178", "l179", "l180", "l181", "l182", "l183", "l184"]], ["GetLoops", ["b139"], [], ["l185", "l186"]], ["GetBlock", [], ["conv2d_nchw", "main"], ["b187"]], ["GetLoops", ["b187"], [], ["l188", "l189", "l190", "l191", "l192", "l193", "l194", "l195", "l196", "l197", "l198", "l199", "l200", "l201", "l202", "l203", "l204", "l205", "l206", "l207"]], ["DecomposeReduction", ["b187", "l191"], [], ["b208"]]], [[12, [1, 1, 1, 1, 1]], [14, [4, 4, 2, 2, 1]], [16, [4, 2, 7, 1, 1]], [18, [4, 1, 7, 1, 2]], [20, [8, 2, 4]], [22, [1, 3, 1]], [24, [1, 1, 3]], [41, 3], [47, 3], [56, 4], [60, 3]]], [2.884992296268795e-05], {"arch": "sm_86", "keys": ["cuda", "gpu"], "kind": "cuda", "max_num_threads": 1024, "max_shared_memory_per_block": 49152, "max_threads_per_block": 1024, "registers_per_block": 65536, "tag": "", "thread_warp_size": 32}, [["TENSOR", "float32", [1, 64, 56, 56]], ["TENSOR", "float32", [64, 64, 3, 3]], ["TENSOR", "float32", [1, 64, 1, 1]], ["TENSOR", "float32", [1, 64, 1, 1]], ["TENSOR", "float32", [64]], ["TENSOR", "float32", [64]], ["TENSOR", "float32", [1, 64, 56, 56]]]]]
[7, [[[["GetBlock", [], ["pad_temp", "main"], ["b0"]], ["GetBlock", [], ["conv2d_nchw", "main"], ["b1"]], ["GetBlock", [], ["T_subtract", "main"], ["b2"]], ["GetBlock", [], ["T_divide", "main"], ["b3"]], ["GetBlock", [], ["expand_dims", "main"], ["b4"]], ["GetBlock", [], ["T_multiply", "main"], ["b5"]], ["GetBlock", [], ["expand_dims_1", "main"], ["b6"]], ["GetBlock", [], ["T_add", "main"], ["b7"]], ["GetBlock", [], ["compute", "main"], ["b8"]], ["GetBlock", [], ["root", "main"], ["b9"]], ["Annotate", ["b1", "\"SSSRRSRS\""], ["meta_schedule.tiling_structure"], []], ["GetLoops", ["b1"], [], ["l10", "l11", "l12", "l13", "l14", "l15", "l16"]], ["SamplePerfectTile", ["l10"], [5, 64], ["v17", "v18", "v19", "v20", "v21"]], ["Split", ["l10", "v17", "v18", "v19", "v20", "v21"], [1, 0], ["l22", "l23", "l24", "l25", "l26"]], ["SamplePerfectTile", ["l11"], [5, 64], ["v27", "v28", "v29", "v30", "v31"]], ["Split", ["l11", "v27", "v28", "v29", "v30", "v31"], [1, 0], ["l32", "l33", "l34", "l35", "l36"]], ["SamplePerfectTile", ["l12"], [5, 64], ["v37", "v38", "v39", "v40", "v41"]], ["Split", ["l12", "v37", "v38", "v39", "v40", "v41"], [1, 0], ["l42", "l43", "l44", "l45", "l46"]], ["SamplePerfectTile", ["l13"], [5, 64], ["v47", "v48", "v49", "v50", "v51"]], ["Split", ["l13", "v47", "v48", "v49", "v50", "v51"], [1, 0], ["l52", "l53", "l54", "l55", "l56"]], ["SamplePerfectTile", ["l14"], [3, 64], ["v57", "v58", "v59"]], ["Split", ["l14", "v57", "v58", "v59"], [1, 0], ["l60", "l61", "l62"]], ["SamplePerfectTile", ["l15"], [3, 64], ["v63", "v64", "v65"]], ["Split", ["l15", "v63", "v64", "v65"], [1, 0], ["l66", "l67", "l68"]], ["SamplePerfectTile", ["l16"], [3, 64], ["v69", "v70", "v71"]], ["Split", ["l16", "v69", "v70", "v71"], [1, 0], ["l72", "l73", "l74"]], ["Reorder", ["l22", "l32", "l42", "l52", "l23", "l33", "l43", "l53", "l24", "l34", "l44", "l54", "l60", "l66", "l72", "l61", "l67", "l73", "l25", "l35", "l45", "l55", "l62", "l68", "l74", "l26", "l36", "l46", "l56"], [], []], ["Fuse", ["l22", "l32", "l42", "l52"], [1], ["l75"]], ["Bind", ["l75"], ["blockIdx.x"], []], ["Fuse", ["l23", "l33", "l43", "l53"], [1], ["l76"]], ["Bind", ["l76"], ["vthread.x"], []], ["Fuse", ["l24", "l34", "l44", "l54"], [1], ["l77"]], ["Bind", ["l77"], ["threadIdx.x"], []], ["Annotate", ["b1", 32], ["meta_schedule.thread_extent_low_inclusive"], []], ["Annotate", ["b1", 1024], ["meta_schedule.thread_extent_high_inclusive"], []], ["CacheWrite", ["b1", []], [0, "local"], ["b78"]], ["ReverseComputeAt", ["b78", "l77"], [1, -1], []], ["CacheRead", ["b1", ["b1"]], [0, "shared"], ["b79"]], ["ComputeAt", ["b79", "l72"], [1, -1], []], ["GetLoops", ["b79"], [], ["l80", "l81", "l82", "l83", "l84", "l85", "l86", "l87", "l88", "l89"]], ["Fuse", ["l86", "l87", "l88", "l89"], [1], ["l90"]], ["SampleCategorical", [], [[1, 2, 3, 4], [0.25, 0.25, 0.25, 0.25]], ["v91"]], ["Annotate", ["b79", "v91"], ["meta_schedule.cooperative_fetch"], []], ["CacheRead", ["b1", ["b1"]], [1, "shared"], ["b92"]], ["ComputeAt", ["b92", "l72"], [1, -1], []], ["GetLoops", ["b92"], [], ["l93", "l94", "l95", "l96", "l97", "l98", "l99", "l100", "l101", "l102"]], ["Fuse", ["l99", "l100", "l101", "l102"], [1], ["l103"]], ["SampleCategorical", [], [[1, 2, 3, 4], [0.25, 0.25, 0.25, 0.25]], ["v104"]], ["Annotate", ["b92", "v104"], ["meta_schedule.cooperative_fetch"], []], ["ReverseComputeInline", ["b8"], [], []], ["ComputeInline", ["b6"], [], []], ["ComputeInline", ["b5"], [], []], ["ComputeInline", ["b4"], [], []], ["ComputeInline", ["b3"], [], []], ["ComputeInline", ["b2"], [], []], ["ComputeInline", ["b0"], [], []], ["SampleCategorical", [], [[0, 16, 64, 512, 1024], [0.2, 0.2, 0.2, 0.2, 0.2]], ["v105"]], ["Annotate", ["b9", "v105"], ["meta_schedule.unroll_explicit"], []], ["GetLoops", ["b7"], [], ["l106", "l107", "l108", "l109"]], ["Fuse", ["l106", "l107", "l108", "l109"], [1], ["l110"]], ["SampleCategorical", [], [[32, 64, 128, 256, 512, 1024], [0.16666666666666666, 0.16666666666666666, 0.16666666666666666, 0.16666666666666666, 0.16666666666666666, 0.16666666666666666]], ["v111"]], ["Split", ["l110", "None", "v111"], [1, 0], ["l112", "l113"]], ["Bind", ["l112"], ["blockIdx.x"], []], ["Bind", ["l113"], ["threadIdx.x"], []], ["EnterPostproc", [], [], []], ["Unannotate", ["b79"], ["meta_schedule.cooperative_fetch"], []], ["GetLoops", ["b79"], [], ["l114", "l115", "l116", "l117", "l118", "l119", "l120"]], ["Split", ["l120", "None", 56, 3], [1, 0], ["l121", "l122", "l123"]], ["Vectorize", ["l123"], [], []], ["Bind", ["l122"], ["threadIdx.x"], []], ["Unannotate", ["b92"], ["meta_schedule.cooperative_fetch"], []], ["GetLoops", ["b92"], [], ["l124", "l125", "l126", "l127", "l128", "l129", "l130"]], ["Split", ["l130", "None", 56, 4], [1, 0], ["l131", "l132", "l133"]], ["Vectorize", ["l133"], [], []], ["Bind", ["l132"], ["threadIdx.x"], []], ["GetBlock", [], ["root", "main"], ["b134"]], ["Unannotate", ["b134"], ["meta_schedule.unroll_explicit"], []], ["GetChildBlocks", ["b134"], [], ["b135", "b136", "b137", "b138", "b139"]], ["GetLoops", ["b135"], [], ["l140", "l141", "l142", "l143", "l144", "l145", "l146", "l147", "l148"]], ["GetLoops", ["b136"], [], ["l149", "l150", "l151", "l152", "l153", "l154", "l155", "l156", "l157"]], ["GetLoops", ["b137"], [], ["l158", "l159", "l160", "l161", "l162", "l163", "l164", "l165", "l166", "l167", "l168", "l169", "l170", "l171", "l172", "l173", "l174", "l175", "l176", "l177"]], ["Annotate", ["l158", 1024], ["pragma_auto_unroll_max_step"], []], ["Annotate", ["l158", 1], ["pragma_unroll_explicit"], []], ["GetLoops", ["b138"], [], ["l178", "l179", "l180", "l181", "l182", "l183", "l184"]], ["GetLoops", ["b139"], [], ["l185", "l186"]], ["GetBlock", [], ["conv2d_nchw", "main"], ["b187"]], ["GetLoops", ["b187"], [], ["l188", "l189", "l190", "l191", "l192", "l193", "l194", "l195", "l196", "l197", "l198", "l199", "l200", "l201", "l202", "l203", "l204", "l205", "l206", "l207"]], ["DecomposeReduction", ["b187", "l191"], [], ["b208"]]], [[12, [1, 1, 1, 1, 1]], [14, [32, 2, 8, 1, 1]], [16, [7, 1, 1, 1, 1]], [18, [1, 1, 7, 1, 1]], [20, [32, 2, 4]], [22, [1, 1, 3]], [24, [1, 3, 1]], [41, 2], [47, 3], [56, 4], [60, 0]]], [4.7988024605103276e-05], {"arch": "sm_86", "keys": ["cuda", "gpu"], "kind": "cuda", "max_num_threads": 1024, "max_shared_memory_per_block": 49152, "max_threads_per_block": 1024, "registers_per_block": 65536, "tag": "", "thread_warp_size": 32}, [["TENSOR", "float32", [1, 256, 14, 14]], ["TENSOR", "float32", [512, 256, 3, 3]], ["TENSOR", "float32", [1, 512, 1, 1]], ["TENSOR", "float32", [1, 512, 1, 1]], ["TENSOR", "float32", [512]], ["TENSOR", "float32", [512]], ["TENSOR", "float32", [1, 512, 7, 7]]]]]
[8, [[[["GetBlock", [], ["pad_temp", "main"], ["b0"]], ["GetBlock", [], ["conv2d_nchw", "main"], ["b1"]], ["GetBlock", [], ["T_subtract", "main"], ["b2"]], ["GetBlock", [], ["T_divide", "main"], ["b3"]], ["GetBlock", [], ["expand_dims", "main"], ["b4"]], ["GetBlock", [], ["T_multiply", "main"], ["b5"]], ["GetBlock", [], ["expand_dims_1", "main"], ["b6"]], ["GetBlock", [], ["T_add", "main"], ["b7"]], ["GetBlock", [], ["T_add_1", "main"], ["b8"]], ["GetBlock", [], ["compute", "main"], ["b9"]], ["GetBlock", [], ["root", "main"], ["b10"]], ["Annotate", ["b1", "\"SSSRRSRS\""], ["meta_schedule.tiling_structure"], []], ["GetLoops", ["b1"], [], ["l11", "l12", "l13", "l14", "l15", "l16", "l17"]], ["SamplePerfectTile", ["l11"], [5, 64], ["v18", "v19", "v20", "v21", "v22"]], ["Split", ["l11", "v18", "v19", "v20", "v21", "v22"], [1, 0], ["l23", "l24", "l25", "l26", "l27"]], ["SamplePerfectTile", ["l12"], [5, 64], ["v28", "v29", "v30", "v31", "v32"]], ["Split", ["l12", "v28", "v29", "v30", "v31", "v32"], [1, 0], ["l33", "l34", "l35", "l36", "l37"]], ["SamplePerfectTile", ["l13"], [5, 64], ["v38", "v39", "v40", "v41", "v42"]], ["Split", ["l13", "v38", "v39", "v40", "v41", "v42"], [1, 0], ["l43", "l44", "l45", "l46", "l47"]], ["SamplePerfectTile", ["l14"], [5, 64], ["v48", "v49", "v50", "v51", "v52"]], ["Split", ["l14", "v48", "v49", "v50", "v51", "v52"], [1, 0], ["l53", "l54", "l55", "l56", "l57"]], ["SamplePerfectTile", ["l15"], [3, 64], ["v58", "v59", "v60"]], ["Split", ["l15", "v58", "v59", "v60"], [1, 0], ["l61", "l62", "l63"]], ["SamplePerfectTile", ["l16"], [3, 64], ["v64", "v65", "v66"]], ["Split", ["l16", "v64", "v65", "v66"], [1, 0], ["l67", "l68", "l69"]], ["SamplePerfectTile", ["l17"], [3, 64], ["v70", "v71", "v72"]], ["Split", ["l17", "v70", "v71", "v72"], [1, 0], ["l73", "l74", "l75"]], ["Reorder", ["l23", "l33", "l43", "l53", "l24", "l34", "l44", "l54", "l25", "l35", "l45", "l55", "l61", "l67", "l73", "l62", "l68", "l74", "l26", "l36", "l46", "l56", "l63", "l69", "l75", "l27", "l37", "l47", "l57"], [], []], ["Fuse", ["l23", "l33", "l43", "l53"], [1], ["l76"]], ["Bind", ["l76"], ["blockIdx.x"], []], ["Fuse", ["l24", "l34", "l44", "l54"], [1], ["l77"]], ["Bind", ["l77"], ["vthread.x"], []], ["Fuse", ["l25", "l35", "l45", "l55"], [1], ["l78"]], ["Bind", ["l78"], ["threadIdx.x"], []], ["Annotate", ["b1", 32], ["meta_schedule.thread_extent_low_inclusive"], []], ["Annotate", ["b1", 1024], ["meta_schedule.thread_extent_high_inclusive"], []], ["CacheWrite", ["b1", []], [0, "local"], ["b79"]], ["ReverseComputeAt", ["b79", "l78"], [1, -1], []], ["CacheRead", ["b1", ["b1"]], [0, "shared"], ["b80"]], ["ComputeAt", ["b80", "l73"], [1, -1], []], ["GetLoops", ["b80"], [], ["l81", "l82", "l83", "l84", "l85", "l86", "l87", "l88", "l89", "l90"]], ["Fuse", ["l87", "l88", "l89", "l90"], [1], ["l91"]], ["SampleCategorical", [], [[1, 2, 3, 4], [0.25, 0.25, 0.25, 0.25]], ["v92"]], ["Annotate", ["b80", "v92"], ["meta_schedule.cooperative_fetch"], []], ["CacheRead", ["b1", ["b1"]], [1, "shared"], ["b93"]], ["ComputeAt", ["b93", "l73"], [1, -1], []], ["GetLoops", ["b93"], [], ["l94", "l95", "l96", "l97", "l98", "l99", "l100", "l101", "l102", "l103"]], ["Fuse", ["l100", "l101", "l102", "l103"], [1], ["l104"]], ["SampleCategorical", [], [[1, 2, 3, 4], [0.25, 0.25, 0.25, 0.25]], ["v105"]], ["Annotate", ["b93", "v105"], ["meta_schedule.cooperative_fetch"], []], ["Fuse", ["l61", "l67", "l73"], [1], ["l106"]], ["Annotate", ["l106", [0, 0, 2]], ["software_pipeline_stage"], []], ["Annotate", ["l106", [0, 1, 2]], ["software_pipeline_order"], []], ["Annotate", ["l106", [0]], ["software_pipeline_async_stages"], []], ["ReverseComputeInline", ["b9"], [], []], ["ReverseComputeInline", ["b8"], [], []], ["ComputeInline", ["b6"], [], []], ["ComputeInline", ["b5"], [], []], ["ComputeInline", ["b4"], [], []], ["ComputeInline", ["b3"], [], []], ["ComputeInline", ["b2"], [], []], ["ComputeInline", ["b0"], [], []], ["SampleCategorical", [], [[0, 16, 64, 512, 1024], [0.2, 0.2, 0.2, 0.2, 0.2]], ["v107"]], ["Annotate", ["b10", "v107"], ["meta_schedule.unroll_explicit"], []], ["GetLoops", ["b7"], [], ["l108", "l109", "l110", "l111"]], ["Fuse", ["l108", "l109", "l110", "l111"], [1], ["l112"]], ["SampleCategorical", [], [[32, 64, 128, 256, 512, 1024], [0.16666666666666666, 0.16666666666666666, 0.16666666666666666, 0.16666666666666666, 0.16666666666666666, 0.16666666666666666]], ["v113"]], ["Split", ["l112", "None", "v113"], [1, 0], ["l114", "l115"]], ["Bind", ["l114"], ["blockIdx.x"], []], ["Bind", ["l115"], ["threadIdx.x"], []], ["EnterPostproc", [], [], []], ["Unannotate", ["b80"], ["meta_schedule.cooperative_fetch"], []], ["GetLoops", ["b80"], [], ["l116", "l117", "l118", "l119", "l120"]], ["Split", ["l120", "None", 98, 4], [1, 0], ["l121", "l122", "l123"]], ["Vectorize", ["l123"], [], []], ["Bind", ["l122"], ["threadIdx.x"], []], ["Unannotate", ["b93"], ["meta_schedule.cooperative_fetch"], []], ["GetLoops", ["b93"], [], ["l124", "l125", "l126", "l127", "l128"]], ["Split", ["l128", "None", 98, 4], [1, 0], ["l129", "l130", "l131"]], ["Vectorize", ["l131"], [], []], ["Bind", ["l130"], ["threadIdx.x"], []], ["GetBlock", [], ["root", "main"], ["b132"]], ["Unannotate", ["b132"], ["meta_schedule.unroll_explicit"], []], ["GetChildBlocks", ["b132"], [], ["b133", "b134", "b135", "b136", "b137"]], ["GetLoops", ["b133"], [], ["l138", "l139", "l140", "l141", "l142", "l143", "l144"]], ["GetLoops", ["b134"], [], ["l145", "l146", "l147", "l148", "l149", "l150", "l151"]], ["GetLoops", ["b135"], [], ["l152", "l153", "l154", "l155", "l156", "l157", "l158", "l159", "l160", "l161", "l162", "l163", "l164", "l165", "l166", "l167", "l168", "l169"]], ["Annotate", ["l152", 1024], ["pragma_auto_unroll_max_step"], []], ["Annotate", ["l152", 1], ["pragma_unroll_explicit"], []], ["GetLoops", ["b136"], [], ["l170", "l171", "l172", "l173", "l174", "l175", "l176"]], ["GetLoops", ["b137"], [], ["l177", "l178"]], ["GetBlock", [], ["conv2d_nchw", "main"], ["b179"]], ["GetLoops", ["b179"], [], ["l180", "l181", "l182", "l183", "l184", "l185", "l186", "l187", "l188", "l189", "l190", "l191", "l192", "l193", "l194", "l195", "l196", "l197"]], ["DecomposeReduction", ["b179", "l183"], [], ["b198"]]], [[13, [1, 1, 1, 1, 1]], [15, [64, 4, 2, 1, 1]], [17, [1, 1, 7, 1, 1]], [19, [1, 1, 7, 1, 1]], [21, [32, 16, 1]], [23, [1, 1, 3]], [25, [1, 1, 3]], [42, 3], [48, 3], [62, 4], [66, 3]]], [6.851808602150539e-05], {"arch": "sm_86", "keys": ["cuda", "gpu"], "kind": "cuda", "max_num_threads": 1024, "max_shared_memory_per_block": 49152, "max_threads_per_block": 1024, "registers_per_block": 65536, "tag": "", "thread_warp_size": 32}, [["TENSOR", "float32", [1, 512, 7, 7]], ["TENSOR", "float32", [512, 512, 3, 3]], ["TENSOR", "float32", [1, 512, 1, 1]], ["TENSOR", "float32", [1, 512, 1, 1]], ["TENSOR", "float32", [512]], ["TENSOR", "float32", [512]], ["TENSOR", "float32", [1, 512, 7, 7]], ["TENSOR", "float32", [1, 512, 7, 7]]]]]
[9, [[[["GetBlock", [], ["pad_temp", "main"], ["b0"]], ["GetBlock", [], ["conv2d_nchw", "main"], ["b1"]], ["GetBlock", [], ["T_subtract", "main"], ["b2"]], ["GetBlock", [], ["T_divide", "main"], ["b3"]], ["GetBlock", [], ["expand_dims", "main"], ["b4"]], ["GetBlock", [], ["T_multiply", "main"], ["b5"]], ["GetBlock", [], ["expand_dims_1", "main"], ["b6"]], ["GetBlock", [], ["T_add", "main"], ["b7"]], ["GetBlock", [], ["compute", "main"], ["b8"]], ["GetBlock", [], ["root", "main"], ["b9"]], ["Annotate", ["b1", "\"SSSRRSRS\""], ["meta_schedule.tiling_structure"], []], ["GetLoops", ["b1"], [], ["l10", "l11", "l12", "l13", "l14", "l15", "l16"]], ["SamplePerfectTile", ["l10"], [5, 64], ["v17", "v18", "v19", "v20", "v21"]], ["Split", ["l10", "v17", "v18", "v19", "v20", "v21"], [1, 0], ["l22", "l23", "l24", "l25", "l26"]], ["SamplePerfectTile", ["l11"], [5, 64], ["v27", "v28", "v29", "v30", "v31"]], ["Split", ["l11", "v27", "v28", "v29", "v30", "v31"], [1, 0], ["l32", "l33", "l34", "l35", "l36"]], ["SamplePerfectTile", ["l12"], [5, 64], ["v37", "v38", "v39", "v40", "v41"]], ["Split", ["l12", "v37", "v38", "v39", "v40", "v41"], [1, 0], ["l42", "l43", "l44", "l45", "l46"]], ["SamplePerfectTile", ["l13"], [5, 64], ["v47", "v48", "v49", "v50", "v51"]], ["Split", ["l13", "v47", "v48", "v49", "v50", "v51"], [1, 0], ["l52", "l53", "l54", "l55", "l56"]], ["SamplePerfectTile", ["l14"], [3, 64], ["v57", "v58", "v59"]], ["Split", ["l14", "v57", "v58", "v59"], [1, 0], ["l60", "l61", "l62"]], ["SamplePerfectTile", ["l15"], [3, 64], ["v63", "v64", "v65"]], ["Split", ["l15", "v63", "v64", "v65"], [1, 0], ["l66", "l67", "l68"]], ["SamplePerfectTile", ["l16"], [3, 64], ["v69", "v70", "v71"]], ["Split", ["l16", "v69", "v70", "v71"], [1, 0], ["l72", "l73", "l74"]], ["Reorder", ["l22", "l32", "l42", "l52", "l23", "l33", "l43", "l53", "l24", "l34", "l44", "l54", "l60", "l66", "l72", "l61", "l67", "l73", "l25", "l35", "l45", "l55", "l62", "l68", "l74", "l26", "l36", "l46", "l56"], [], []], ["Fuse", ["l22", "l32", "l42", "l52"], [1], ["l75"]], ["Bind", ["l75"], ["blockIdx.x"], []], ["Fuse", ["l23", "l33", "l43", "l53"], [1], ["l76"]], ["Bind", ["l76"], ["vthread.x"], []], ["Fuse", ["l24", "l34", "l44", "l54"], [1], ["l77"]], ["Bind", ["l77"], ["threadIdx.x"], []], ["Annotate", ["b1", 32], ["meta_schedule.thread_extent_low_inclusive"], []], ["Annotate", ["b1", 1024], ["meta_schedule.thread_extent_high_inclusive"], []], ["CacheWrite", ["b1", []], [0, "local"], ["b78"]], ["ReverseComputeAt", ["b78", "l77"], [1, -1], []], ["CacheRead", ["b1", ["b1"]], [0, "shared"], ["b79"]], ["ComputeAt", ["b79", "l72"], [1, -1], []], ["GetLoops", ["b79"], [], ["l80", "l81", "l82", "l83", "l84", "l85", "l86", "l87", "l88", "l89"]], ["Fuse", ["l86", "l87", "l88", "l89"], [1], ["l90"]], ["SampleCategorical", [], [[1, 2, 3, 4], [0.25, 0.25, 0.25, 0.25]], ["v91"]], ["Annotate", ["b79", "v91"], ["meta_schedule.cooperative_fetch"], []], ["CacheRead", ["b1", ["b1"]], [1, "shared"], ["b92"]], ["ComputeAt", ["b92", "l72"], [1, -1], []], ["GetLoops", ["b92"], [], ["l93", "l94", "l95", "l96", "l97", "l98", "l99", "l100", "l101", "l102"]], ["Fuse", ["l99", "l100", "l101", "l102"], [1], ["l103"]], ["SampleCategorical", [], [[1, 2, 3, 4], [0.25, 0.25, 0.25, 0.25]], ["v104"]], ["Annotate", ["b92", "v104"], ["meta_schedule.cooperative_fetch"], []], ["Fuse", ["l60", "l66", "l72"], [1], ["l105"]], ["Annotate", ["l105", [0, 0, 3]], ["software_pipeline_stage"], []], ["Annotate", ["l105", [0, 1, 2]], ["software_pipeline_order"], []], ["Annotate", ["l105", [0]], ["software_pipeline_async_stages"], []], ["ReverseComputeInline", ["b8"], [], []], ["ComputeInline", ["b6"], [], []], ["ComputeInline", ["b5"], [], []], ["ComputeInline", ["b4"], [], []], ["ComputeInline", ["b3"], [], []], ["ComputeInline", ["b2"], [], []], ["ComputeInline", ["b0"], [], []], ["SampleCategorical", [], [[0, 16, 64, 512, 1024], [0.2, 0.2, 0.2, 0.2, 0.2]], ["v106"]], ["Annotate", ["b9", "v106"], ["meta_schedule.unroll_explicit"], []], ["GetLoops", ["b7"], [], ["l107", "l108", "l109", "l110"]], ["Fuse", ["l107", "l108", "l109", "l110"], [1], ["l111"]], ["SampleCategorical", [], [[32, 64, 128, 256, 512, 1024], [0.16666666666666666, 0.16666666666666666, 0.16666666666666666, 0.16666666666666666, 0.16666666666666666, 0.16666666666666666]], ["v112"]], ["Split", ["l111", "None", "v112"], [1, 0], ["l113", "l114"]], ["Bind", ["l113"], ["blockIdx.x"], []], ["Bind", ["l114"], ["threadIdx.x"], []], ["EnterPostproc", [], [], []], ["Unannotate", ["b79"], ["meta_schedule.cooperative_fetch"], []], ["GetLoops", ["b79"], [], ["l115", "l116", "l117", "l118", "l119"]], ["Split", ["l119", "None", 224, 3], [1, 0], ["l120", "l121", "l122"]], ["Vectorize", ["l122"], [], []], ["Bind", ["l121"], ["threadIdx.x"], []], ["Unannotate", ["b92"], ["meta_schedule.cooperative_fetch"], []], ["GetLoops", ["b92"], [], ["l123", "l124", "l125", "l126", "l127"]], ["Split", ["l127", "None", 224, 2], [1, 0], ["l128", "l129", "l130"]], ["Vectorize", ["l130"], [], []], ["Bind", ["l129"], ["threadIdx.x"], []], ["GetBlock", [], ["root", "main"], ["b131"]], ["Unannotate", ["b131"], ["meta_schedule.unroll_explicit"], []], ["GetChildBlocks", ["b131"], [], ["b132", "b133", "b134", "b135", "b136"]], ["GetLoops", ["b132"], [], ["l137", "l138", "l139", "l140", "l141", "l142", "l143"]], ["GetLoops", ["b133"], [], ["l144", "l145", "l146", "l147", "l148", "l149", "l150"]], ["GetLoops", ["b134"], [], ["l151", "l152", "l153", "l154", "l155", "l156", "l157", "l158", "l159", "l160", "l161", "l162", "l163", "l164", "l165", "l166", "l167", "l168"]], ["Annotate", ["l151", 512], ["pragma_auto_unroll_max_step"], []], ["Annotate", ["l151", 1], ["pragma_unroll_explicit"], []], ["GetLoops", ["b135"], [], ["l169", "l170", "l171", "l172", "l173", "l174", "l175"]], ["GetLoops", ["b136"], [], ["l176", "l177"]], ["GetBlock", [], ["conv2d_nchw", "main"], ["b178"]], ["GetLoops", ["b178"], [], ["l179", "l180", "l181", "l182", "l183", "l184", "l185", "l186", "l187", "l188", "l189", "l190", "l191", "l192", "l193", "l194", "l195", "l196"]], ["DecomposeReduction", ["b178", "l182"], [], ["b197"]]], [[12, [1, 1, 1, 1, 1]], [14, [4, 1, 16, 1, 2]], [16, [14, 1, 1, 2, 1]], [18, [1, 1, 14, 1, 2]], [20, [16, 4, 2]], [22, [3, 1, 1]], [24, [1, 1, 3]], [41, 2], [47, 1], [60, 3], [64, 2]]], [4.287261860718172e-05], {"arch": "sm_86", "keys": ["cuda", "gpu"], "kind": "cuda", "max_num_threads": 1024, "max_shared_memory_per_block": 49152, "max_threads_per_block": 1024, "registers_per_block": 65536, "tag": "", "thread_warp_size": 32}, [["TENSOR", "float32", [1, 128, 28, 28]], ["TENSOR", "float32", [128, 128, 3, 3]], ["TENSOR", "float32", [1, 128, 1, 1]], ["TENSOR", "float32", [1, 128, 1, 1]], ["TENSOR", "float32", [128]], ["TENSOR", "float32", [128]], ["TENSOR", "float32", [1, 128, 28, 28]]]]]
[10, [[[["GetBlock", [], ["pad_temp", "main"], ["b0"]], ["GetBlock", [], ["conv2d_nchw", "main"], ["b1"]], ["GetBlock", [], ["T_subtract", "main"], ["b2"]], ["GetBlock", [], ["T_divide", "main"], ["b3"]], ["GetBlock", [], ["expand_dims", "main"], ["b4"]], ["GetBlock", [], ["T_multiply", "main"], ["b5"]], ["GetBlock", [], ["expand_dims_1", "main"], ["b6"]], ["GetBlock", [], ["T_add", "main"], ["b7"]], ["GetBlock", [], ["root", "main"], ["b8"]], ["Annotate", ["b1", "\"SSSRRSRS\""], ["meta_schedule.tiling_structure"], []], ["GetLoops", ["b1"], [], ["l9", "l10", "l11", "l12", "l13", "l14", "l15"]], ["SamplePerfectTile", ["l9"], [5, 64], ["v16", "v17", "v18", "v19", "v20"]], ["Split", ["l9", "v16", "v17", "v18", "v19", "v20"], [1, 0], ["l21", "l22", "l23", "l24", "l25"]], ["SamplePerfectTile", ["l10"], [5, 64], ["v26", "v27", "v28", "v29", "v30"]], ["Split", ["l10", "v26", "v27", "v28", "v29", "v30"], [1, 0], ["l31", "l32", "l33", "l34", "l35"]], ["SamplePerfectTile", ["l11"], [5, 64], ["v36", "v37", "v38", "v39", "v40"]], ["Split", ["l11", "v36", "v37", "v38", "v39", "v40"], [1, 0], ["l41", "l42", "l43", "l44", "l45"]], ["SamplePerfectTile", ["l12"], [5, 64], ["v46", "v47", "v48", "v49", "v50"]], ["Split", ["l12", "v46", "v47", "v48", "v49", "v50"], [1, 0], ["l51", "l52", "l53", "l54", "l55"]], ["SamplePerfectTile", ["l13"], [3, 64], ["v56", "v57", "v58"]], ["Split", ["l13", "v56", "v57", "v58"], [1, 0], ["l59", "l60", "l61"]], ["SamplePerfectTile", ["l14"], [3, 64], ["v62", "v63", "v64"]], ["Split", ["l14", "v62", "v63", "v64"], [1, 0], ["l65", "l66", "l67"]], ["SamplePerfectTile", ["l15"], [3, 64], ["v68", "v69", "v70"]], ["Split", ["l15", "v68", "v69", "v70"], [1, 0], ["l71", "l72", "l73"]], ["Reorder", ["l21", "l31", "l41", "l51", "l22", "l32", "l42", "l52", "l23", "l33", "l43", "l53", "l59", "l65", "l71", "l60", "l66", "l72", "l24", "l34", "l44", "l54", "l61", "l67", "l73", "l25", "l35", "l45", "l55"], [], []], ["Fuse", ["l21", "l31", "l41", "l51"], [1], ["l74"]], ["Bind", ["l74"], ["blockIdx.x"], []], ["Fuse", ["l22", "l32", "l42", "l52"], [1], ["l75"]], ["Bind", ["l75"], ["vthread.x"], []], ["Fuse", ["l23", "l33", "l43", "l53"], [1], ["l76"]], ["Bind", ["l76"], ["threadIdx.x"], []], ["Annotate", ["b1", 32], ["meta_schedule.thread_extent_low_inclusive"], []], ["Annotate", ["b1", 1024], ["meta_schedule.thread_extent_high_inclusive"], []], ["CacheWrite", ["b1", []], [0, "local"], ["b77"]], ["ReverseComputeAt", ["b77", "l76"], [1, -1], []], ["CacheRead", ["b1", ["b1"]], [0, "shared"], ["b78"]], ["ComputeAt", ["b78", "l71"], [1, -1], []], ["GetLoops", ["b78"], [], ["l79", "l80", "l81", "l82", "l83", "l84", "l85", "l86", "l87", "l88"]], ["Fuse", ["l85", "l86", "l87", "l88"], [1], ["l89"]], ["SampleCategorical", [], [[1, 2, 3, 4], [0.25, 0.25, 0.25, 0.25]], ["v90"]], ["Annotate", ["b78", "v90"], ["meta_schedule.cooperative_fetch"], []], ["CacheRead", ["b1", ["b1"]], [1, "shared"], ["b91"]], ["ComputeAt", ["b91", "l71"], [1, -1], []], ["GetLoops", ["b91"], [], ["l92", "l93", "l94", "l95", "l96", "l97", "l98", "l99", "l100", "l101"]], ["Fuse", ["l98", "l99", "l100", "l101"], [1], ["l102"]], ["SampleCategorical", [], [[1, 2, 3, 4], [0.25, 0.25, 0.25, 0.25]], ["v103"]], ["Annotate", ["b91", "v103"], ["meta_schedule.cooperative_fetch"], []], ["Fuse", ["l59", "l65", "l71"], [1], ["l104"]], ["Annotate", ["l104", [0, 0, 3]], ["software_pipeline_stage"], []], ["Annotate", ["l104", [0, 1, 2]], ["software_pipeline_order"], []], ["Annotate", ["l104", [0]], ["software_pipeline_async_stages"], []], ["ComputeInline", ["b6"], [], []], ["ComputeInline", ["b5"], [], []], ["ComputeInline", ["b4"], [], []], ["ComputeInline", ["b3"], [], []], ["ComputeInline", ["b2"], [], []], ["ComputeInline", ["b0"], [], []], ["SampleCategorical", [], [[0, 16, 64, 512, 1024], [0.2, 0.2, 0.2, 0.2, 0.2]], ["v105"]], ["Annotate", ["b8", "v105"], ["meta_schedule.unroll_explicit"], []], ["GetLoops", ["b7"], [], ["l106", "l107", "l108", "l109"]], ["Fuse", ["l106", "l107", "l108", "l109"], [1], ["l110"]], ["SampleCategorical", [], [[32, 64, 128, 256, 512, 1024], [0.16666666666666666, 0.16666666666666666, 0.16666666666666666, 0.16666666666666666, 0.16666666666666666, 0.16666666666666666]], ["v111"]], ["Split", ["l110", "None", "v111"], [1, 0], ["l112", "l113"]], ["Bind", ["l112"], ["blockIdx.x"], []], ["Bind", ["l113"], ["threadIdx.x"], []], ["EnterPostproc", [], [], []], ["Unannotate", ["b78"], ["meta_schedule.cooperative_fetch"], []], ["GetLoops", ["b78"], [], ["l114", "l115", "l116", "l117", "l118"]], ["Split", ["l118", "None", 448, 2], [1, 0], ["l119", "l120", "l121"]], ["Vectorize", ["l121"], [], []], ["Bind", ["l120"], ["threadIdx.x"], []], ["Unannotate", ["b91"], ["meta_schedule.cooperative_fetch"], []], ["GetLoops", ["b91"], [], ["l122", "l123", "l124", "l125", "l126"]], ["Split", ["l126", "None", 448, 2], [1, 0], ["l127", "l128", "l129"]], ["Vectorize", ["l129"], [], []], ["Bind", ["l128"], ["threadIdx.x"], []], ["GetBlock", [], ["root", "main"], ["b130"]], ["Unannotate", ["b130"], ["meta_schedule.unroll_explicit"], []], ["GetChildBlocks", ["b130"], [], ["b131", "b132", "b133", "b134", "b135"]], ["GetLoops", ["b131"], [], ["l136", "l137", "l138", "l139", "l140", "l141", "l142"]], ["GetLoops", ["b132"], [], ["l143", "l144", "l145", "l146", "l147", "l148", "l149"]], ["GetLoops", ["b133"], [], ["l150", "l151", "l152", "l153", "l154", "l155", "l156", "l157", "l158", "l159", "l160", "l161", "l162", "l163", "l164", "l165", "l166", "l167"]], ["Annotate", ["l150", 512], ["pragma_auto_unroll_max_step"], []], ["Annotate", ["l150", 1], ["pragma_unroll_explicit"], []], ["GetLoops", ["b134"], [], ["l168", "l169", "l170", "l171", "l172", "l173", "l174"]], ["GetLoops", ["b135"], [], ["l175", "l176"]], ["GetBlock", [], ["conv2d_nchw", "main"], ["b177"]], ["GetLoops", ["b177"], [], ["l178", "l179", "l180", "l181", "l182", "l183", "l184", "l185", "l186", "l187", "l188", "l189", "l190", "l191", "l192", "l193", "l194", "l195"]], ["DecomposeReduction", ["b177", "l181"], [], ["b196"]]], [[11, [1, 1, 1, 1, 1]], [13, [4, 2, 64, 1, 1]], [15, [1, 1, 7, 1, 1]], [17, [7, 1, 1, 1, 1]], [19, [16, 2, 8]], [21, [1, 1, 1]], [23, [1, 1, 1]], [40, 1], [46, 1], [58, 3], [62, 2]]], [1.5588341669408796e-05], {"arch": "sm_86", "keys": ["cuda", "gpu"], "kind": "cuda", "max_num_threads": 1024, "max_shared_memory_per_block": 49152, "max_threads_per_block": 1024, "registers_per_block": 65536, "tag": "", "thread_warp_size": 32}, [["TENSOR", "float32", [1, 256, 14, 14]], ["TENSOR", "float32", [512, 256, 1, 1]], ["TENSOR", "float32", [1, 512, 1, 1]], ["TENSOR", "float32", [1, 512, 1, 1]], ["TENSOR", "float32", [512]], ["TENSOR", "float32", [512]], ["TENSOR", "float32", [1, 512, 7, 7]]]]]
[11, [[[["GetBlock", [], ["pad_temp", "main"], ["b0"]], ["GetBlock", [], ["pool_max", "main"], ["b1"]], ["GetBlock", [], ["root", "main"], ["b2"]], ["Unannotate", ["b1"], ["schedule_rule"], []], ["ComputeInline", ["b0"], [], []], ["SampleCategorical", [], [[0, 16, 64, 512, 1024], [0.2, 0.2, 0.2, 0.2, 0.2]], ["v3"]], ["Annotate", ["b2", "v3"], ["meta_schedule.unroll_explicit"], []], ["GetLoops", ["b1"], [], ["l4", "l5", "l6", "l7", "l8", "l9"]], ["Fuse", ["l4", "l5", "l6", "l7"], [1], ["l10"]], ["SampleCategorical", [], [[32, 64, 128, 256, 512, 1024], [0.16666666666666666, 0.16666666666666666, 0.16666666666666666, 0.16666666666666666, 0.16666666666666666, 0.16666666666666666]], ["v11"]], ["Split", ["l10", "None", "v11"], [1, 0], ["l12", "l13"]], ["Bind", ["l12"], ["blockIdx.x"], []], ["Bind", ["l13"], ["threadIdx.x"], []], ["EnterPostproc", [], [], []], ["GetBlock", [], ["root", "main"], ["b14"]], ["Unannotate", ["b14"], ["meta_schedule.unroll_explicit"], []], ["GetChildBlocks", ["b14"], [], ["b15"]], ["GetLoops", ["b15"], [], ["l16", "l17", "l18", "l19"]], ["GetBlock", [], ["pool_max", "main"], ["b20"]], ["GetLoops", ["b20"], [], ["l21", "l22", "l23", "l24"]], ["DecomposeReduction", ["b20", "l23"], [], ["b25"]]], [[5, 0], [9, 4]]], [3.479365440599448e-06], {"arch": "sm_86", "keys": ["cuda", "gpu"], "kind": "cuda", "max_num_threads": 1024, "max_shared_memory_per_block": 49152, "max_threads_per_block": 1024, "registers_per_block": 65536, "tag": "", "thread_warp_size": 32}, [["TENSOR", "float32", [1, 64, 112, 112]], ["TENSOR", "float32", [1, 64, 56, 56]]]]]
[12, [[[["GetBlock", [], ["pad_temp", "main"], ["b0"]], ["GetBlock", [], ["conv2d_nchw", "main"], ["b1"]], ["GetBlock", [], ["T_subtract", "main"], ["b2"]], ["GetBlock", [], ["T_divide", "main"], ["b3"]], ["GetBlock", [], ["expand_dims", "main"], ["b4"]], ["GetBlock", [], ["T_multiply", "main"], ["b5"]], ["GetBlock", [], ["expand_dims_1", "main"], ["b6"]], ["GetBlock", [], ["T_add", "main"], ["b7"]], ["GetBlock", [], ["T_add_1", "main"], ["b8"]], ["GetBlock", [], ["compute", "main"], ["b9"]], ["GetBlock", [], ["root", "main"], ["b10"]], ["Annotate", ["b1", "\"SSSRRSRS\""], ["meta_schedule.tiling_structure"], []], ["GetLoops", ["b1"], [], ["l11", "l12", "l13", "l14", "l15", "l16", "l17"]], ["SamplePerfectTile", ["l11"], [5, 64], ["v18", "v19", "v20", "v21", "v22"]], ["Split", ["l11", "v18", "v19", "v20", "v21", "v22"], [1, 0], ["l23", "l24", "l25", "l26", "l27"]], ["SamplePerfectTile", ["l12"], [5, 64], ["v28", "v29", "v30", "v31", "v32"]], ["Split", ["l12", "v28", "v29", "v30", "v31", "v32"], [1, 0], ["l33", "l34", "l35", "l36", "l37"]], ["SamplePerfectTile", ["l13"], [5, 64], ["v38", "v39", "v40", "v41", "v42"]], ["Split", ["l13", "v38", "v39", "v40", "v41", "v42"], [1, 0], ["l43", "l44", "l45", "l46", "l47"]], ["SamplePerfectTile", ["l14"], [5, 64], ["v48", "v49", "v50", "v51", "v52"]], ["Split", ["l14", "v48", "v49", "v50", "v51", "v52"], [1, 0], ["l53", "l54", "l55", "l56", "l57"]], ["SamplePerfectTile", ["l15"], [3, 64], ["v58", "v59", "v60"]], ["Split", ["l15", "v58", "v59", "v60"], [1, 0], ["l61", "l62", "l63"]], ["SamplePerfectTile", ["l16"], [3, 64], ["v64", "v65", "v66"]], ["Split", ["l16", "v64", "v65", "v66"], [1, 0], ["l67", "l68", "l69"]], ["SamplePerfectTile", ["l17"], [3, 64], ["v70", "v71", "v72"]], ["Split", ["l17", "v70", "v71", "v72"], [1, 0], ["l73", "l74", "l75"]], ["Reorder", ["l23", "l33", "l43", "l53", "l24", "l34", "l44", "l54", "l25", "l35", "l45", "l55", "l61", "l67", "l73", "l62", "l68", "l74", "l26", "l36", "l46", "l56", "l63", "l69", "l75", "l27", "l37", "l47", "l57"], [], []], ["Fuse", ["l23", "l33", "l43", "l53"], [1], ["l76"]], ["Bind", ["l76"], ["blockIdx.x"], []], ["Fuse", ["l24", "l34", "l44", "l54"], [1], ["l77"]], ["Bind", ["l77"], ["vthread.x"], []], ["Fuse", ["l25", "l35", "l45", "l55"], [1], ["l78"]], ["Bind", ["l78"], ["threadIdx.x"], []], ["Annotate", ["b1", 32], ["meta_schedule.thread_extent_low_inclusive"], []], ["Annotate", ["b1", 1024], ["meta_schedule.thread_extent_high_inclusive"], []], ["CacheWrite", ["b1", []], [0, "local"], ["b79"]], ["ReverseComputeAt", ["b79", "l78"], [1, -1], []], ["CacheRead", ["b1", ["b1"]], [0, "shared"], ["b80"]], ["ComputeAt", ["b80", "l73"], [1, -1], []], ["GetLoops", ["b80"], [], ["l81", "l82", "l83", "l84", "l85", "l86", "l87", "l88", "l89", "l90"]], ["Fuse", ["l87", "l88", "l89", "l90"], [1], ["l91"]], ["SampleCategorical", [], [[1, 2, 3, 4], [0.25, 0.25, 0.25, 0.25]], ["v92"]], ["Annotate", ["b80", "v92"], ["meta_schedule.cooperative_fetch"], []], ["CacheRead", ["b1", ["b1"]], [1, "shared"], ["b93"]], ["ComputeAt", ["b93", "l73"], [1, -1], []], ["GetLoops", ["b93"], [], ["l94", "l95", "l96", "l97", "l98", "l99", "l100", "l101", "l102", "l103"]], ["Fuse", ["l100", "l101", "l102", "l103"], [1], ["l104"]], ["SampleCategorical", [], [[1, 2, 3, 4], [0.25, 0.25, 0.25, 0.25]], ["v105"]], ["Annotate", ["b93", "v105"], ["meta_schedule.cooperative_fetch"], []], ["ReverseComputeInline", ["b9"], [], []], ["ReverseComputeInline", ["b8"], [], []], ["ComputeInline", ["b6"], [], []], ["ComputeInline", ["b5"], [], []], ["ComputeInline", ["b4"], [], []], ["ComputeInline", ["b3"], [], []], ["ComputeInline", ["b2"], [], []], ["ComputeInline", ["b0"], [], []], ["SampleCategorical", [], [[0, 16, 64, 512, 1024], [0.2, 0.2, 0.2, 0.2, 0.2]], ["v106"]], ["Annotate", ["b10", "v106"], ["meta_schedule.unroll_explicit"], []], ["GetLoops", ["b7"], [], ["l107", "l108", "l109", "l110"]], ["Fuse", ["l107", "l108", "l109", "l110"], [1], ["l111"]], ["SampleCategorical", [], [[32, 64, 128, 256, 512, 1024], [0.16666666666666666, 0.16666666666666666, 0.16666666666666666, 0.16666666666666666, 0.16666666666666666, 0.16666666666666666]], ["v112"]], ["Split", ["l111", "None", "v112"], [1, 0], ["l113", "l114"]], ["Bind", ["l113"], ["blockIdx.x"], []], ["Bind", ["l114"], ["threadIdx.x"], []], ["EnterPostproc", [], [], []], ["Unannotate", ["b80"], ["meta_schedule.cooperative_fetch"], []], ["GetLoops", ["b80"], [], ["l115", "l116", "l117", "l118", "l119", "l120", "l121"]], ["Split", ["l121", "None", 112, 4], [1, 0], ["l122", "l123", "l124"]], ["Vectorize", ["l124"], [], []], ["Bind", ["l123"], ["threadIdx.x"], []], ["Unannotate", ["b93"], ["meta_schedule.cooperative_fetch"], []], ["GetLoops", ["b93"], [], ["l125", "l126", "l127", "l128", "l129", "l130", "l131"]], ["Split", ["l131", "None", 112, 4], [1, 0], ["l132", "l133", "l134"]], ["Vectorize", ["l134"], [], []], ["Bind", ["l133"], ["threadIdx.x"], []], ["GetBlock", [], ["root", "main"], ["b135"]], ["Unannotate", ["b135"], ["meta_schedule.unroll_explicit"], []], ["GetChildBlocks", ["b135"], [], ["b136", "b137", "b138", "b139", "b140"]], ["GetLoops", ["b136"], [], ["l141", "l142", "l143", "l144", "l145", "l146", "l147", "l148", "l149"]], ["GetLoops", ["b137"], [], ["l150", "l151", "l152", "l153", "l154", "l155", "l156", "l157", "l158"]], ["GetLoops", ["b138"], [], ["l159", "l160", "l161", "l162", "l163", "l164", "l165", "l166", "l167", "l168", "l169", "l170", "l171", "l172", "l173", "l174", "l175", "l176", "l177", "l178"]], ["Annotate", ["l159", 1024], ["pragma_auto_unroll_max_step"], []], ["Annotate", ["l159", 1], ["pragma_unroll_explicit"], []], ["GetLoops", ["b139"], [], ["l179", "l180", "l181", "l182", "l183", "l184", "l185"]], ["GetLoops", ["b140"], [], ["l186", "l187"]], ["GetBlock", [], ["conv2d_nchw", "main"], ["b188"]], ["GetLoops", ["b188"], [], ["l189", "l190", "l191", "l192", "l193", "l194", "l195", "l196", "l197", "l198", "l199", "l200", "l201", "l202", "l203", "l204", "l205", "l206", "l207", "l208"]], ["DecomposeReduction", ["b188", "l192"], [], ["b209"]]], [[13, [1, 1, 1, 1, 1]], [15, [8, 4, 8, 1, 1]], [17, [7, 1, 1, 1, 2]], [19, [1, 1, 14, 1, 1]], [21, [32, 2, 4]], [23, [1, 1, 3]], [25, [1, 3, 1]], [42, 3], [48, 3], [58, 4], [62, 1]]], [4.28812092577376e-05], {"arch": "sm_86", "keys": ["cuda", "gpu"], "kind": "cuda", "max_num_threads": 1024, "max_shared_memory_per_block": 49152, "max_threads_per_block": 1024, "registers_per_block": 65536, "tag": "", "thread_warp_size": 32}, [["TENSOR", "float32", [1, 256, 14, 14]], ["TENSOR", "float32", [256, 256, 3, 3]], ["TENSOR", "float32", [1, 256, 1, 1]], ["TENSOR", "float32", [1, 256, 1, 1]], ["TENSOR", "float32", [256]], ["TENSOR", "float32", [256]], ["TENSOR", "float32", [1, 256, 14, 14]], ["TENSOR", "float32", [1, 256, 14, 14]]]]]
